{
  "batch_id": "batch_fixture_01",
  "contract_id": "unlimited-skills.fleet-wire",
  "contract_version": 1,
  "installation_id": "uls_inst_fixture",
  "message_type": "receipt-batch",
  "receipts": [
    {
      "activation_nonce": "act_fixture_01",
      "active_archive_sha256": "sha256:bbbbbbbbbbbbbbbbbbbbbbbbbbbbbbbbbbbbbbbbbbbbbbbbbbbbbbbbbbbbbbbb",
      "adapter_version": "1.0.0",
      "agent_id": "agent_fixture_01",
      "archive_sha256": "sha256:bbbbbbbbbbbbbbbbbbbbbbbbbbbbbbbbbbbbbbbbbbbbbbbbbbbbbbbbbbbbbbbb",
      "attempt_id": "attempt_fixture_01",
      "client_timestamp": "2026-07-27T00:01:00Z",
      "client_version": "0.6.9",
      "contract_id": "unlimited-skills.fleet-wire",
      "contract_version": 1,
      "control_epoch": 7,
      "desired_state_revision": "ds_fixture_b",
      "event_id": "evt_fixture_01",
      "event_seq": 7,
      "event_type": "RUNTIME_ATTESTED",
      "idempotency_key": "evt_fixture_01",
      "message_type": "receipt-event",
      "pack_id": "pack_fixture",
      "reason_code": "none",
      "release_id": "release_b",
      "rollout_id": "rollout_fixture_b",
      "runtime_generation": "generation_fixture_02"
    }
  ]
}
